word,part_of_speech,meaning,example,phonetic_symbol,audio_link
absence,noun;;,缺席；缺勤；不在场;;不存在；缺乏;;,"A new manager was appointed during/in her absence.;;她不在的时候任命了一位新经理。;;She has had repeated absences from work this year.;;今年她屡次旷工。;;He drew attention to the absence of concrete evidence against the defendant.;;他使大家注意到，可以证明被告有罪的确凿证据并不存在。;;In the absence of (= because there were not) more suitable candidates, we decided to offer the job to Mr Conway.;;由于没有更为合适的人选，我们决定任命康韦先生。;;",/ˈæb.səns/,https://dictionary.cambridge.org/media/english-chinese-simplified/uk_pron/u/uka/ukabr/ukabrea015.mp3
abstract,adjective;;noun;;,抽象的;纯理论的;纯概念的;;（辩论或讨论）抽象的；空泛的；空洞的;;抽象概念;理论;;抽象（派）的;;摘要;梗概;;抽象画;抽象派艺术作品;;,Truth and beauty are abstract concepts.;;真和美都是抽象的概念。;;This debate is becoming too abstract - let's have some hard facts!;;这场辩论变得太空洞了，拿出一些具体的事实根据来吧！;;I have difficulty dealing with the abstract - let's discuss particular cases.;;我难以理解抽象概念，我们讨论一些具体的案例吧。;;So far we've only discussed the question in the abstract (= without referring to any real examples).;;目前我们只是泛泛地讨论过这个问题。;;abstract art;;抽象艺术;;an abstract painter;;抽象派画家;;There is a section at the end of the magazine that includes abstracts of recent articles/books.;;杂志的最后一部分收录了近期发表的文章／出版的书籍的摘要。;;,/ˈæb.strækt/,
academic,adjective;;noun;;,学校的;学院的;学术的;;聪明好学的;学习好的;;纯理论的;不关联实际的;;大学教师;学者;;（中学或大学的）学科;;,academic subjects/qualifications/books;;学科／学历／学术书籍;;an academic institution;;学术机构;;the academic year (= the time during which students go to school or college);;学年;;academic standards;;学术水平;;I was never a particularly academic child.;;我从来就不是个特别好学的孩子。;;a purely academic argument/question;;纯理论的论点／不切实际的问题;;,/ˌæk.əˈdem.ɪk/,
accelerate,verb;;,（车辆或驾驶者）加速;;（人或物的行动）加快;;（使）加快，（使）增速;促进;提前，（促使）早日发生;;,"I accelerated to overtake the bus.;;我加速超过了公共汽车。;;Inflation is likely to accelerate this year, adding further upward pressure on interest rates.;;今年通货膨胀可能会加剧，迫使利率持续走高。;;They use special chemicals to accelerate the growth of crops.;;他们使用特殊的化学品来刺激农作物生长。;;",/əkˈsel.ə.reɪt/,
accessible,adjective;;suffix;;,可以理解的;易懂的;;可进入的，可接近的；可得到的;;可获得的，可及的;;,"The resort is easily accessible by road, rail, and air.;;这个旅游胜地交通便利，坐汽车、火车和飞机都可以到达。;;The problem with some of these drugs is that they are so very accessible.;;此类毒品的问题在于其中的一些很容易获取。;;Lea Anderson is a choreographer who believes in making dance accessible.;;作为一个舞蹈编导，利•安德森认为应该使舞蹈通俗易懂。;;Covent Garden has made some attempt to make opera accessible to a wider public.;;考文特花园皇家歌剧院已做出一些努力，以让更多的人来欣赏歌剧。;;The stadium currently has 90 wheelchair-accessible seats.;;该体育场目前有90个轮椅无障碍座位。;;Computer-accessible medical records avoid paper waste and save time.;;计算机可查询的医疗记录避免了纸张浪费且节省了时间。;;The device has two front-accessible USB ports.;;该设备有两个前置 USB 端口。;;",/əkˈses.ə.bəl/,
accompany,verb;;,陪同，陪伴;伴随，和…一起发生（或存在）;;陪送，陪同前往;;陪同，陪伴（某人参加社交或文娱活动）;;为…伴唱或伴奏;;,"The course books are accompanied by four CDs.;;这些课本配有4张光盘。;;Depression is almost always accompanied by insomnia.;;抑郁症几乎总是伴有失眠。;;The salmon was accompanied by (= served with) a fresh green salad.;;那道三文鱼菜佐以新鲜的蔬菜色拉。;;Would you like me to accompany you to your room?;;我送你到房间去，好吗？;;""May I accompany you to the ball?"" he asked her.;;“我可以陪您去参加舞会吗？”他问她。;;I have two tickets for the theatre on Saturday evening - would you like to accompany me?;;“我有两张周六晚上的戏票，你愿意陪我一起去吗？”;;Miss Jessop accompanied Mr Bentley on the piano.;;杰索普小姐为本特利先生钢琴伴奏。;;",/əˈkʌm.pə.ni/,https://dictionary.cambridge.org/media/english-chinese-simplified/uk_pron/u/uka/ukacc/ukacces017.mp3
accomplish,verb;;,完成；实现；达到；做到;;,The students accomplished the task in less than ten minutes.;;学生们不到10分钟就完成了任务。;;She accomplished such a lot during her visit.;;她在访问期间取得了丰硕的成果。;;I feel as if I've accomplished nothing since I left my job.;;我觉得辞掉工作以后就一直在虚度光阴。;;,/əˈkʌm.plɪʃ/,https://dictionary.cambridge.org/media/english-chinese-simplified/uk_pron/u/uka/ukacc/ukacces019.mp3
account,noun;;verb;;,账户，户头;;报道;报告;记述;描述;;根据各方面所说;据说;大家都说;;据…自己所说;;由于，因为;;赊销账;赊欠账;赊购;;客户;主顾;;不重要；无足轻重;;认为是;视为;;,"I've opened an account with a building society.;;我在房屋互助协会开了个账户。;;I paid the money into my account this morning.;;今天上午我把钱存入了我的账户。;;She paid the cheque into her account.;;她把支票存入了账户。;;She deposited the check in her account.;;她把支票存入了账户。;;I need to draw some money out of my account.;;我得从我的账户上取出一些钱来。;;She gave a thrilling account of her life in the jungle.;;她把自己在丛林中生活的经历描述得惊险刺激。;;He kept a detailed account of the suspect's movements.;;他详细记录了犯罪嫌疑人的一举一动。;;Several eyewitnesses' accounts differed considerably from the official version of events.;;几个目击者对于事件的叙述和官方的说法有很大出入。;;By all accounts, San Francisco is a city that's easy to fall in love with.;;人人都说旧金山是个很容易令人倾心的城市。;;By his own account, he's quite wealthy.;;他自称很富有。;;He doesn't drink alcohol on account of his poor health.;;出于健康原因，他不喝酒。;;Could you put it on/charge it to my account (= can I pay for it later), please?;;把这笔钱记在我的（赊购）账上好吗？;;Do you have an account at this store/with us, madam?;;女士，你在我们商店有赊购账户吗？;;Could you please pay/settle your account in full (= give us all the money you owe us)?;;您可以把赊的账全结清吗？;;If the advertising agency loses this account, it will make a big dent in their profits.;;如果该广告公司丢掉了这个客户，他们的利润就会锐减。;;It's of no account to me whether he comes or not.;;他来不来对我来说都无关紧要。;;His opinion is of little account to me.;;对我来说，他的意见无足轻重。;;She was accounted a genius by all who knew her work.;;所有知道她作品的人都认为她是个天才。;;",/əˈkaʊnt/,https://dictionary.cambridge.org/media/english-chinese-simplified/uk_pron/u/uka/ukacc/ukacces028.mp3
accurate,adjective;;,准确的；精确的；正确的;;,an accurate machine;;精密的机器;;an accurate description;;准确的描述;;The figures they have used are just not accurate.;;他们引用的数字太不准确。;;Her novel is an accurate reflection of life in Spain.;;她的小说是西班牙生活的真实写照。;;We hope to become more accurate in predicting earthquakes.;;我们希望能更准确地预报地震。;;,/ˈæk.jə.rət/,https://dictionary.cambridge.org/media/english-chinese-simplified/uk_pron/u/uka/ukacc/ukaccou015.mp3
acknowledge,verb;;,承认;认可…属实或存在;;（通过信函或邮件等）确认收悉;;,She acknowledged having been at fault.;;她承认自己有过错。;;She acknowledged that she had been at fault.;;她承认自己有过错。;;You must acknowledge the truth of her argument.;;你必须承认她论点的真实性。;;Historians generally acknowledge her as a genius in her field.;;历史学家们公认她是该领域中的天才。;;She is usually acknowledged to be one of our best artists.;;她通常被认为是我们这个时代最伟大的艺术家之一。;;They refused to acknowledge (= to recognize officially) the new government.;;他们拒绝承认新政府。;;He didn't even acknowledge my presence (= show that he had seen me).;;他见到我连个招呼都没有打。;;The government won't even acknowledge the existence of the problem.;;政府甚至都不承认这个问题的存在。;;Please acknowledge receipt of this letter.;;收到此信，请复函告知。;;,/əkˈnɒl.ɪdʒ/,
acoustic,adjective;;noun;;,声音的;听觉的;;（乐器）原声的，自然声的，不用电传音的;;（建筑物、房间的）传音效果，音响效果;;,The microphone converts acoustic waves to electrical signals for transmission.;;麦克风把声波转换成电信号进行传送。;;an acoustic guitar;;原声吉他;;The concert was recorded in a church that is famous for its acoustics.;;这场音乐会是在一座以音响效果闻名的教堂内录制的。;;,/əˈkuː.stɪk/,
acquisition,noun;;,获得;;购置品（常用于收藏）;;收购物（房屋、公司、土地等）;收购;;,The acquisition of huge amounts of data has helped our research enormously.;;获得的大量数据对我们的研究有莫大的帮助。;;Language acquisition (= learning a language without being taught) starts at a very young age.;;语言习得始于幼年。;;The museum's latest acquisition is a four-million-dollar sculpture.;;该博物馆最新购置的藏品为一尊价值400万美元的雕塑。;;I like your earrings - are they a recent acquisition? (= Did you get them recently?);;我挺喜欢你的耳环——你刚买的吗？;;,/ˌæk.wɪˈzɪʃ.ən/,
activate,verb;;,启动，开动；激活;;（尤指通过加热）加速…的化学反应;;,The alarm is activated by the lightest pressure.;;最轻微的压力也会触动警报。;;,/ˈæk.tɪ.veɪt/,
adapt,verb;;,适应;适合;;使适应不同情况（或用途）;改动;改造;改装;改编;;,"Many software companies have adapted popular programs to the new operating system.;;许多软件公司已经改编了常用的程序以适应新的操作系统。;;The recipe here is a pork roast adapted from Caroline O'Neill's book ""Louisiana Kitchen"".;;这道菜是根据卡罗琳•奥尼尔《路易斯安那厨房》一书中烤猪肉的做法改进而来的。;;We had to adapt our plans to fit Jack's timetable.;;我们不得不改变我们的计划来适应杰克的时间安排。;;The play had been adapted for (= changed to make it suitable for) children.;;这个剧本已被改编成儿童剧。;;Davies is busy adapting Brinkworth's latest novel for television.;;戴维斯正忙着把布尔克沃斯的最新小说改编成电视剧。;;The good thing about children is that they adapt very easily to new environments.;;小孩的长处就是能够很容易地适应新环境。;;It took me a while to adapt to the new job.;;我过了一段时间才适应了新工作。;;",/əˈdæpt/,
adequate,adjective;;,足够的;合格的;合乎需要的;;,Have we got adequate food for 20 guests?;;我们的食物够招待20位客人吗？;;I didn't have adequate time to prepare.;;我没有充足的时间来准备。;;It's not a big salary but it's adequate for our needs.;;工资虽不优厚，但足以满足我们的需要了。;;The council's provision for the elderly is barely adequate (= is not enough).;;市政会给老年人提供的保障不足。;;Will future oil supplies be adequate to meet world needs?;;未来的石油供应能满足世界的需要吗？;;,/ˈæd.ə.kwət/,https://dictionary.cambridge.org/media/english-chinese-simplified/uk_pron/u/uka/ukada/ukadapt029.mp3
adjust,verb;;,（尤指为了使某物更正确、有效或合适而）调整;调节;;整理（衣着）;;适应;习惯;;,"If the chair is too high you can adjust it to suit you.;;如果椅子太高了，你可以把它调到适合你的高度。;;As a teacher you have to adjust your methods to suit the needs of slower children.;;作为一名老师，你必须调整教学方法来适应那些学得较慢的孩子的需要。;;She adjusted her skirt, took a deep breath, and walked into the room.;;她整了整裙子，深吸一口气，走进了房间。;;I can't adjust to living on my own.;;我不习惯独自生活。;;Her eyes slowly adjusted to the dark.;;她的眼睛慢慢适应了黑暗。;;The lifestyle is so very different - it takes a while to adjust.;;生活方式差别太大了，得过一段时间才能适应。;;",/əˈdʒʌst/,https://dictionary.cambridge.org/media/english-chinese-simplified/uk_pron/u/uka/ukadh/ukadher028.mp3
administration,noun;;,管理；经营；行政;;（企业、机关等的）管理人员;行政人员;管理部门;;一届政府或政府人员（如总统及其内阁）;;提供;施用;;管理令程序，即公司资不抵债时的一种拯救程序，允许公司变更管理人以避免清算。;;,"Teachers complain that more of their time is taken up with administration than with teaching.;;教师们抱怨他们花在行政工作上的时间超过了教学的时间。;;She has little experience in admin (= in organizing a business, etc.).;;她没有什么管理经验。;;The decision to cancel the trip was made by the school administration.;;取消行程的决定是学校管理部门做出的。;;the Obama administration/the last Republican administration;;奥巴马政府／上届共和党政府;;There are strict controls on the administration of drugs.;;药品的施用受严格控制。;;The company has gone into administration, in order for money to be returned to creditors.;;公司已进入管理令程序，以期将资金返还债权人。;;",/ədˌmɪn.ɪˈstreɪ.ʃən/,https://dictionary.cambridge.org/media/english-chinese-simplified/uk_pron/u/uka/ukadj/ukadjus007.mp3
adopt,verb;;,收养;领养;;接受;采用;采纳;;选定;选用;采用;;养成某种习惯;;,"They've adopted a baby girl.;;他们领养了一个女婴。;;She had the child adopted (= she gave her baby to someone else to take care of).;;她把自己的孩子送给别人抚养。;;They have no children of their own, but they're hoping to adopt.;;他们没有亲生子女，但是希望能领养。;;I think it's time to adopt a different strategy in my dealings with him.;;我觉得在和他的交往中该采用一种不同的策略了。;;The new tax would force companies to adopt energy-saving measures.;;征收新税将迫使公司采取节能措施。;;He's adopted a remarkably light-hearted attitude towards the situation.;;面对这种局面，他摆出了一种异乎寻常的轻描淡写的态度。;;Dr Kennedy has been adopted as the party's candidate for South Cambridge.;;肯尼迪博士被选定为该党南剑桥地区的候选人。;;Roz has adopted one or two funny mannerisms since she's been away.;;罗兹自她离开后养成了一两种可笑的怪癖。;;",/əˈdɒpt/,https://dictionary.cambridge.org/media/english-chinese-simplified/uk_pron/u/uka/ukadm/ukadmon008.mp3
advent,noun;;noun;;,（事件、发明或人物的）出现，来临，到来;;降临节（圣诞节前的四个星期）;;,Life was transformed by the advent of the steam engine.;;蒸汽机的出现使人类生活发生了翻天覆地的变化。;;,/ˈæd.vent/,https://dictionary.cambridge.org/media/english-chinese-simplified/uk_pron/u/uka/ukadu/ukadult013.mp3
adventure,noun;;,冒险，历险;奇遇;刺激;;,She had some exciting adventures in Egypt.;;她在埃及经历了一些很刺激的奇遇。;;We got lost on the Metro - it was quite an adventure.;;我们在地铁里迷了路，还真是挺惊险的。;;Sam won't come - he's got no sense of adventure (= he does not enjoy dangerous or exciting situations).;;萨姆不会来的，他不喜欢冒险。;;,/ədˈven.tʃər/,https://dictionary.cambridge.org/media/english-chinese-simplified/uk_pron/u/uka/ukadu/ukadult017.mp3
advocate,verb;;noun;;,主张;拥护;支持;提倡;;辩护律师;;主张人；拥护人；支持者；提倡者;;,She advocates taking a more long-term view.;;她主张把目光放得更长远一些。;;He advocates the return of capital punishment.;;他主张恢复死刑。;;He's a strong advocate of state ownership of the railways.;;他是铁路国有的积极倡导者。;;,/ˈæd.və.keɪt/,https://dictionary.cambridge.org/media/english-chinese-simplified/uk_pron/u/uka/ukadv/ukadver013.mp3
affect,verb;;,影响；侵袭；感染；打动;;假装;;（为引人注意或自抬身价而）刻意穿戴，故作;;,Both buildings were badly affected by the fire.;;两座楼都在大火中严重受损。;;The divorce affected every aspect of her life.;;离婚使她生活的各个方面都受到了影响。;;It's a disease that affects mainly older people.;;这是一种主要侵扰老年人的疾病。;;I was deeply affected by the film (= it caused strong feelings in me).;;我被电影深深地打动了。;;To all his problems she affected indifference.;;对他所有的问题，她都装作漠不关心的样子。;;At university he affected an upper-class accent.;;在大学里他拿腔捏调假装上流社会口音。;;He's recently affected a hat and cane.;;近来，他头上戴了顶帽子，手上拿了根拐杖，装腔作势起来。;;,/əˈfekt/,https://dictionary.cambridge.org/media/english-chinese-simplified/uk_pron/u/uka/ukaer/ukaerog018.mp3
agent,noun;;,代理人；代理商;;（演员、艺术家、作家等的）经纪人，代理人;;特工人员;间谍;;原动力，动因；作用剂;;,Please contact our agent in Spain for further information.;;如需更多信息，请联系本公司在西班牙的代理。;;a secret/foreign agent;;特工人员／外国间谍;;a powerful cleaning agent;;高效清洁剂;;a raising agent for cakes;;蛋糕发酵剂;;a clotting agent;;凝结剂;;He was the agent of their destruction.;;是他导致了他们的毁灭。;;,/ˈeɪ.dʒənt/,https://dictionary.cambridge.org/media/english-chinese-simplified/uk_pron/u/uka/ukage/ukage__010.mp3
alter,verb;;,（通常指轻微地）改动，修改;改变，（使）变化;;改动（衣服使其更合身）;;阉割，切除;;,"We've had to alter some of our plans.;;我们不得不对一些计划作了改动。;;Although the cost of making phone calls is going up, the charge for connecting to the internet will not alter.;;尽管话费上涨了，上网费不会变。;;Giving up our car has radically altered our lifestyle.;;弃车不用使我们的生活方式发生了根本性的变化。;;I took the coat back to the shop to have it altered.;;我把外套拿回店里去改一下。;;",/ˈɒl.tər/,https://dictionary.cambridge.org/media/english-chinese-simplified/uk_pron/e/epd/epd31/epd31150.mp3
altitude,noun;;,海拔，海拔高度;;,"We are currently flying at an altitude of 15,000 metres.;;现在我们正在15000米的高度上飞行。;;Mountain climbers use oxygen when they reach higher altitudes.;;到了海拔较高的地方，登山者就要使用氧气。;;",/ˈæl.tɪ.tʃuːd/,https://dictionary.cambridge.org/media/english-chinese-simplified/uk_pron/u/uka/ukalt/ukaltar014.mp3
analyse,verb;;,分析;;,"Researchers analysed the purchases of 6,300 households.;;研究者们对6300个家庭的购物消费作了分析。;;Water samples taken from streams were analysed for contamination by chemicals.;;对水样进行分析，来测定溪流是否已受到化学品的污染。;;",/ˈæn.əl.aɪz/,https://dictionary.cambridge.org/media/english-chinese-simplified/uk_pron/u/uka/ukamu/ukamusi023.mp3
anthropology,noun;;,人类学;;,,/ˌæn.θrəˈpɒl.ə.dʒi/,https://dictionary.cambridge.org/media/english-chinese-simplified/uk_pron/u/uka/ukant/ukantep019.mp3
anticipate,verb;;,预期，期望;预料;;采取行动来防止;先发制人;;,We don't anticipate any trouble.;;我们不希望出现任何问题。;;We had one or two difficulties along the way that we didn't anticipate.;;在进行的过程中，我们遇到一两个没有预料到的难题。;;Are you anticipating a lot of people at the party tonight?;;你预计今晚的聚会会有很多人来吗？;;They anticipate having several applicants for the job.;;他们预计会有几个人来应聘这份工作。;;They anticipate that they will have several applicants for the job;;他们预计会有几个人来应聘这份工作。;;At this stage we can't really anticipate what will happen.;;在这个阶段我们真的无法预料会发生什么。;;The anticipated inflation figure is lower than last month's.;;预计中的通货膨胀数字低于上月。;;It's always best to anticipate a problem before it arises.;;防患于未然永远都是最明智之举。;;The army anticipated (= took action in preparation for) the explosion by evacuating the town.;;这支军队预料会发生爆炸，已疏散了镇上居民。;;,/ænˈtɪs.ɪ.peɪt/,https://dictionary.cambridge.org/media/english-chinese-simplified/uk_pron/u/uka/ukant/ukantep026.mp3
apparent,adjective;;,清晰可见的；显而易见的；明白易懂的;;表面上的；貌似（真实）的；显得…的;;,"Her unhappiness was apparent to everyone.;;谁都看得出来她很不开心。;;It was becoming increasingly apparent that he could no longer take care of himself.;;他再也无法自理生活了，这一点日益明显。;;I was on the metro this morning when, for no apparent reason, the man opposite me suddenly screamed.;;今天上午在地铁上，我对面的一个男人突然莫名其妙地尖叫起来。;;There are one or two apparent discrepancies between the two reports.;;这两份报告看上去有一两处出入。;;She has this apparent innocence which, I suspect, she uses to her advantage.;;她貌似天真，但我认为，这只是对她有利的伪装。;;",/əˈpær.ənt/,https://dictionary.cambridge.org/media/english-chinese-simplified/uk_pron/u/uka/ukapo/ukapolo020.mp3
appeal,noun;;verb;;,对…有吸引力;对…有感染力;引起兴趣;;（尤指向公众的）呼吁，吁请，求助，恳求;;（尤指为了改变法律或官方裁决而提出的）诉请，异议，申诉;;吸引力;感染力;魅力;;（尤指向公众）呼吁，吁请，求助，恳求;;（尤指为寻求减轻处罚而向更高一级法院提出）上诉;;（尤指为了改变法律或官方裁决而）诉请裁决，提出异议，申诉;;,"They're launching (= starting) an appeal to raise money for famine victims.;;他们正在呼吁社会为饥民捐款。;;The police have issued an appeal to the public to stay away from the area over the weekend.;;警察呼吁公众在周末远离这一地区。;;The case went to the court of appeal/the appeal court.;;案件被提交到上诉法院。;;He won his appeal and the sentence was halved.;;他上诉获胜，刑期减半。;;She has lodged (= made) an appeal against the severity of the fine.;;她认为罚金太高，已提起申诉。;;sex appeal;;性感;;Spielberg's movies have a wide appeal.;;斯皮尔伯格的影片广受欢迎。;;This used to be a marvellous hotel but it has lost its appeal in recent years.;;这家旅馆曾经非常好，可是近年来却失去了吸引力。;;They're appealing for clothes and blankets to send to the devastated region.;;他们正在呼吁公众向受灾地区捐献衣物和毛毯。;;The police are appealing to the public for any information about the missing girl.;;警方正向公众求助，请他们提供有关失踪女孩的任何信息。;;I tried to appeal to (= ask for support based on) his sense of loyalty, stressing how good the company had been to him.;;我努力请他对公司保持忠诚，着重强调公司一贯待他不薄。;;Church leaders have appealed to the government to halt the war.;;教会领袖呼吁政府停止战争。;;The teenager has been given leave (= allowed) by the High Court to appeal against her two-year sentence.;;该少女被判刑两年，高级法院允许她如不服判决可提起上诉。;;They're appealing to the court to reduce the sentence to a fine.;;他们正向法院提起上诉，要求将判刑改为罚款。;;The parents appealed against the school's decision not to admit the child.;;这个孩子的父母对学校拒收孩子的决定提出申诉。;;The players appealed to the referee for a free kick.;;运动员请求裁判判罚任意球。;;It's a programme designed to appeal mainly to 16 to 25-year-olds.;;这个节目的目标观众主要是16到25岁的年轻人。;;I think what appeals to me about his painting is his use of colour.;;我想，他的画感染我的地方在于他对色彩的运用。;;I haven't been skiing - it's never really appealed.;;我从来没有滑过雪——我对它从不感兴趣。;;",/əˈpiːl/,https://dictionary.cambridge.org/media/english-chinese-simplified/uk_pron/u/uka/ukapo/ukapolo023.mp3
applicant,noun;;,（尤指求职于或考大学的）申请人;;,How many applicants did you have for the job?;;申请这个工作的有多少人？;;,/ˈæp.lɪ.kənt/,https://dictionary.cambridge.org/media/english-chinese-simplified/uk_pron/u/uka/ukapp/ukappen019.mp3
