word,part_of_speech,meaning,example,phonetic_symbol,audio_link
appraisal,noun;;,评定；鉴定；估价；评价;;（工作／业绩）鉴定;;,"The newspaper gave an editorial appraisal of the government's achievements of the past year.;;这家报纸发表社论，对政府在过去一年的业绩作出评价。;;Many companies operate regular job appraisals, often on an annual basis.;;许多公司定期对雇员进行工作鉴定，通常是每年一次。;;",/əˈpreɪ.zəl/,https://dictionary.cambridge.org/media/english-chinese-simplified/uk_pron/u/uka/ukapp/ukappra001.mp3
appreciation,noun;;,欣赏;理解;感谢;;（价格，价值等的）上涨，增值;;,Max has no appreciation of the finer things in life.;;马克斯对生活中高雅点的事物都不懂欣赏。;;The crowd cheered in appreciation.;;观众喝彩叫好。;;Children rarely show any appreciation of/for what their parents do for them.;;孩子们对父母为自己所做的一切鲜少表现出感激之情。;;These flowers are a token of my appreciation of/for all your help.;;你们给予我那么多帮助，这些鲜花聊表谢意。;;There has been little appreciation in the value of property recently.;;最近房地产价格几乎没有上涨。;;,/əˌpriː.ʃiˈeɪ.ʃən/,https://dictionary.cambridge.org/media/english-chinese-simplified/uk_pron/u/uka/ukapp/ukappra008.mp3
apprenticeship,noun;;,学徒期;;,,/əˈpren.tɪs.ʃɪp/,https://dictionary.cambridge.org/media/english-chinese-simplified/uk_pron/u/uka/ukapp/ukappra016.mp3
approach,verb;;noun;;,靠近；接近；临近;;（思考问题的）方式，方法，态度;;着手处理；对付;;接洽;交涉;找…商谈;要求;;靠近;接近;临近;;通路，路径，路线;;与…最近似（或相似）的事物;;接洽;要求;商谈;;,"We could just see the train approaching in the distance.;;我们刚好能看到火车从远处驶来。;;If you look out of the window on the left, you'll see that we're now approaching the Eiffel Tower.;;如果你从左侧的窗口望出去，就可以看到我们正在驶向埃菲尔铁塔。;;I see it's approaching lunchtime, so let's take a break.;;午饭时间快到了，我们休息一下吧。;;In my opinion, no other composers even begin to approach (= come near in quality to) Mozart.;;我认为，任何作曲家和莫扎特相比，都难以望其项背。;;The total amount raised so far is approaching (= almost) $1,000.;;目前筹集到的金额总数将近1000美元了。;;He's very active for a man approaching 80 (= who is almost 80 years old).;;对于一个年近80的老人来说，他精力旺盛。;;I'm not sure how to approach the problem.;;怎样处理这个问题，我没有把握。;;We've just approached the bank for/about a loan.;;我们刚刚联系银行要求贷款。;;She's been approached by a modelling agency.;;一家模特代理公司曾与她接洽过。;;Since our research so far has not produced any answers to this problem, we need to adopt a different approach to it.;;到目前为止，我们还没有研究出任何解决这一问题的方法，所以我们得换一种思路了。;;I've just read an interesting book which has a new approach to Shakespeare.;;我刚读了一本非常有趣的书，它提供了一种对莎士比亚作品的全新解读方式。;;Michael is always very logical in his approach.;;迈克尔的处事方法一贯非常合情合理。;;The siren signalled the approach of an ambulance.;;警笛声表明一辆救护车正在驶来。;;Many kinds of birds fly south at the approach of winter.;;很多鸟在冬天来临之际飞向南方。;;Please fasten your seat belts, the plane is now making its final approach (in)to (= is coming near to and preparing to land at) Heathrow.;;请系好安全带，飞机马上就要在希思罗机场降落。;;There is a very steep approach to the house.;;有一条很险的路通往那座房子。;;We got stuck in a traffic jam on the approach road.;;我们遇上塞车，被堵在引道上了。;;That's the nearest approach to an apology you're going to get from Paula.;;你别想从葆拉那儿得到真正的道歉，她那样做就已经是很不错了。;;The hospital is making approaches to local businesses (= asking them to help) in their bid to raise money.;;为了筹款，医院正在同当地的公司商谈，请求他们解囊相助。;;I hear that Everton have made an approach to (= an attempt to make a business arrangement with) Arsenal to buy one of their players.;;我听说艾弗顿队跟阿森纳队进行过接洽，意欲出钱转入他们的一名球员。;;",/əˈprəʊtʃ/,https://dictionary.cambridge.org/media/english-chinese-simplified/uk_pron/u/uka/ukapp/ukappra018.mp3
appropriate,adjective;;verb;;,适当的，恰当的；合适的;;挪用;占用;盗用;侵吞;;拨出（款项）;;,appropriate footwear for the country;;适于在乡间穿的鞋;;Is this film appropriate for small children?;;这部电影适合幼童观看吗？;;I didn't think his comments were very appropriate at the time.;;我觉得他在当时发表那些评论很不妥当。;;Is this an appropriate occasion to discuss finance?;;这个场合适于讨论财政问题吗？;;Please complete the appropriate parts of this form (= the parts that are right or necessary for your particular situation) and return it as soon as possible.;;请正确填写表中相关部分并尽快交回。;;He lost his job when he was found to have appropriated some of the company's money.;;他被发现侵吞公司钱款后就丢了工作。;;The government have appropriated millions of pounds for the project.;;政府已经为该项目拨款数百万英镑。;;,/əˈprəʊ.pri.ət/,https://dictionary.cambridge.org/media/english-chinese-simplified/uk_pron/u/uka/ukapp/ukappra022.mp3
approximate,adjective;;verb;;,大致的，大约的，大概的;;接近，近似;;,"The train's approximate time of arrival is 10.30.;;这列火车大概在10点30分到站。;;The approximate cost will be about $600.;;费用大约为600美元。;;Can you give me an approximate idea of the numbers involved?;;你能粗略地告诉我参与的人数吗？;;The newspaper reports of the discussion only roughly approximated to (= were not exactly the same as) what was actually said.;;报纸关于这次商讨的报道并不完全符合实际。;;Student numbers this year are expected to approximate 5,000 (= to be about 5,000).;;预计今年学生人数可达5000人左右。;;",/əˈprɒk.sɪ.mət/,https://dictionary.cambridge.org/media/english-chinese-simplified/uk_pron/u/uka/ukapp/ukappro004.mp3
archaeology,noun;;,考古学;;,,/ˌɑː.kiˈɒl.ə.dʒi/,https://dictionary.cambridge.org/media/english-chinese-simplified/uk_pron/u/uka/ukarc/ukarcha004.mp3
architect,noun;;,建筑师;;设计师;创造者;缔造者;;,Bevan was the architect of the British National Health Service.;;比万是英国国民保健制度的缔造者。;;,/ˈɑː.kɪ.tekt/,https://dictionary.cambridge.org/media/english-chinese-simplified/uk_pron/u/uka/ukarc/ukarcha025.mp3
arctic,noun;;adjective;;,北极，北极地区;;北极的;;极其寒冷的;;,Polar bears live in the Arctic.;;北极熊生活在北极地区。;;No trees grow in the Arctic regions.;;北极地区不生长树木。;;The North of England has been experiencing Arctic conditions these past few days.;;过去的几天里，英格兰北部天气极其寒冷。;;,/ˈɑːk.tɪk/,https://dictionary.cambridge.org/media/english-chinese-simplified/uk_pron/u/uka/ukarc/ukarchi007.mp3
arise,verb;;,发生；产生；出现;;起床;;,"Should the opportunity arise, I'd love to go to China.;;要是有机会的话，我很想去中国。;;Could you work on Saturday, should the need arise (= if it were to be necessary)?;;万一有需要，你可以在星期六工作吗？;;Are there any matters arising from (= caused by) the last meeting?;;上次会议有没有引出什么问题？;;We arose early on Christmas morning.;;圣诞节早晨，我们早早地起了床。;;",/əˈraɪz/,https://dictionary.cambridge.org/media/english-chinese-simplified/uk_pron/u/uka/ukarg/ukargyb006.mp3
arousal,noun;;,性欲激起;;,Physiological changes take place during sexual arousal.;;在性欲激起期间会发生生理变化。;;Pain during intercourse can be caused by lack of arousal.;;性交过程中的疼痛可能是由于性欲未激起而引起的。;;,/əˈraʊ.zəl/,https://dictionary.cambridge.org/media/english-chinese-simplified/uk_pron/u/uka/ukarm/ukarmho015.mp3
arrange,verb;;,安排;准备;筹划;;整理，使有条理；排列；布置;;改编（乐曲）;;,I'm trying to arrange my work so that I can have a couple of days off next week.;;我正设法把工作安排好，以便下周能够休息两天。;;The meeting has been arranged for Wednesday.;;会议已经安排在了周三。;;They arranged to have dinner the following month.;;他们约在下个月共进晚餐。;;I've already arranged with him to meet at the cinema.;;我已和他约好了在电影院见面。;;She's arranged for her son to have swimming lessons.;;她已经安排她儿子去上游泳课了。;;I'd deliberately arranged that they should arrive at the same time.;;我特意安排好让他们同时到达。;;We haven't yet arranged when to meet.;;我们还没有约好什么时候会面。;;She arranged her birthday cards along the shelf.;;她把生日贺卡在架子上摆成一排。;;Who arranged these flowers so beautifully?;;这花插得真漂亮，谁的手艺？;;His books are neatly arranged in alphabetical order.;;他的书都按照字母顺序排得整整齐齐。;;Beethoven's fifth symphony has been arranged for the piano.;;贝多芬的第五交响乐被改编成了钢琴曲。;;,/əˈreɪndʒ/,https://dictionary.cambridge.org/media/english-chinese-simplified/uk_pron/u/uka/ukarm/ukarmho023.mp3
artificial,adjective;;,人造的，人工的;仿造的;;虚假的，不真诚的;矫揉造作的;;,clothes made of artificial fibres;;人造纤维面料的服装;;an artificial heart;;人造心脏;;an artificial lake;;人工湖;;artificial fur/sweeteners/flowers;;人造毛皮／人造甜味剂／假花;;Their cheerfulness seemed rather strained and artificial.;;他们的高兴表情看上去非常做作虚伪。;;,/ˌɑː.tɪˈfɪʃ.əl/,https://dictionary.cambridge.org/media/english-chinese-simplified/uk_pron/u/uka/ukart/ukartic010.mp3
ash,noun;;noun;;,（尤指烟草、煤、木头燃烧后的）灰，灰烬;;白蜡木;;灰烬，废墟;（尤指人火化后的）骨灰;;白蜡树;枔;;（澳大利亚、英国、美国的）禁烟与保健行动组织（Action on Smoking and Health的缩写）;;,cigarette ash;;烟灰;;Her ashes were scattered at sea.;;她的骨灰撒在了大海里。;;Allied bombing left Dresden in ashes in 1945.;;1945年盟军对德累斯顿发动轰炸，将其夷为平地。;;,/æʃ/,https://dictionary.cambridge.org/media/english-chinese-simplified/uk_pron/u/uka/ukasb/ukasbes020.mp3
assess,verb;;,评价;评定;对…估价;;,"The insurers will need to assess the flood damage.;;保险公司需要对洪水造成的损失进行估定。;;They assessed the cost of the flood damage at £2,500.;;他们估定洪水造成的损失为2500英镑。;;Exams are not the only means of assessing a student's ability.;;考试并不是评定学生能力的唯一手段。;;It's too early to assess the long-term consequences of the two countries' union.;;现在判定两国联盟的长期影响还为时过早。;;We need to assess whether the project is worth doing.;;我们需要评估一下这个项目是否值得去做。;;",/əˈses/,https://dictionary.cambridge.org/media/english-chinese-simplified/uk_pron/u/uka/ukass/ukassau013.mp3
assign,verb;;,分配;分派;指派;;定出，确定（时间或期限）;;把…归属（于）;确定（属性等）;;把…归因（于）;确定（原因）;;委派;选派;派遣;;（在计算机内存中）为…赋值;;把（财产、权利等）让与，转让;;,"UN troops were assigned the task of rebuilding the hospital.;;重建这所医院的任务被指派给了联合国部队。;;The case has been assigned to our most senior officer.;;这个案件已经指派给我们最高级别的警官来处理。;;Have you assigned a day for the interviews yet?;;你们定下哪一天进行面试了吗？;;Each visitor to the site chooses an online alter ego, which is assigned a name. ;;该网站的每个访问者都会选择一个线上的分身，后者会分配到一个名称。;;Detectives have been unable to assign a motive for the murder.;;侦探们一直无法确定谋杀的动机。;;The report assigned the blame for the accident to inadequate safety regulations.;;报告中，事故的责任被归咎于安全规章不健全。;;She was assigned to the newspaper's Berlin office.;;她被派到报社驻柏林的办事处。;;Her property was assigned to her grandchildren.;;她的财产转让给了她的孙辈。;;",/əˈsaɪn/,https://dictionary.cambridge.org/media/english-chinese-simplified/uk_pron/u/uka/ukass/ukassau022.mp3
assist,verb;;noun;;,帮助；协助；援助;;配合警方的询问;;（篮球、足球等的）助攻;（棒球等的）助杀;;,The army arrived to assist in the search.;;军队赶到协助搜寻。;;You will be expected to assist the editor with the selection of illustrations for the book.;;希望你能帮助编辑为本书挑选插图。;;Ozil has the most assists in the Premier League this season.;;本赛季联赛中厄齐尔助攻打入的球最多。;;,/əˈsɪst/,https://dictionary.cambridge.org/media/english-chinese-simplified/uk_pron/u/uka/ukass/ukassau028.mp3
associate,verb;;noun;;adjective;;,副的;准的;非正式的;;朋友;同事;（生意）伙伴;;将…（与…）联系起来，把…联系在一起;;副学士，准学士;;,Most people associate this brand with good quality.;;大多数人把这个品牌和优良品质联系在一起。;;A close associate of the author denied reports that she had cancer.;;作者的一个密友否认了她患癌症的报道。;;a business associate;;生意伙伴;;an associate of arts;;文科准学士;;an associate member of an organization;;一个组织的准会员;;associate director/producer;;副导演／制片人;;,/əˈsəʊ.si.eɪt/,https://dictionary.cambridge.org/media/english-chinese-simplified/uk_pron/u/uka/ukass/ukassiz004.mp3
assumption,noun;;,假定;假设;臆断;;夺取；获得（权力等）；承担（责任等）;;,People tend to make assumptions about you when you have a disability.;;如果你有残疾，人们往往就会对你妄加臆断。;;These calculations are based on the assumption that prices will continue to rise.;;这些计算是基于价格会继续上升这一假定之上的。;;The revolutionaries' assumption of power took the army by surprise.;;革命者突然夺取政权，使军队措手不及。;;,/əˈsʌmp.ʃən/,https://dictionary.cambridge.org/media/english-chinese-simplified/uk_pron/u/uka/ukass/ukassiz014.mp3
